{
  "$schema": "../../../../schema/intgrid.json",
  "format": 1,
  "layer": "collision",
  "legend": {
    "#": "solid",
    "-": "oneway",
    ".": null,
    "/": "ramp_r",
    "L": "ramp_l",
    "b": "breakable",
    "f": "fortified",
    "x": "hazard",
    "~": "water"
  },
  "rows": [
    "################################################################",
    "#fff....##..........##...................##.........##.........#",
    "#fff....##..........##...................##.........##.........#",
    "#.......##...............................##....................#",
    "#........................................##....................#",
    "#..............................................................#",
    "#..............................................................#",
    "#..............................................................#",
    "#..............................................................#",
    "#..............................................................#",
    "#..............................................................#",
    "#..............................................................#",
    "#..............................................................#",
    "#..............................................................#",
    "#..............................................................#",
    "#..............................................................#",
    "#..............................................................#",
    "#..............................................................#",
    "#..............................................................#",
    "#..............................................................#",
    "#..............................................................#",
    "#..............................................................#",
    "#..............................................................#",
    "#..............................................................#",
    "#..............................................................#",
    "################################################################",
    "################################################################",
    "################################################################"
  ]
}
